{
  "assets": [
    {
      "id": "f2aef6b6-befd-4afb-8bf5-27d7ed5a9597",
      "metadata": {},
      "normalized_value": "ginandjuice.shop",
      "sources": [
        {
          "metadata": {},
          "provider": "configured_target",
          "reference": null
        },
        {
          "metadata": {},
          "provider": "web:page",
          "reference": null
        },
        {
          "metadata": {},
          "provider": "html:data-action",
          "reference": null
        },
        {
          "metadata": {},
          "provider": "html:link:href",
          "reference": null
        },
        {
          "metadata": {},
          "provider": "html:script:src",
          "reference": null
        },
        {
          "metadata": {},
          "provider": "html:a:href",
          "reference": null
        },
        {
          "metadata": {},
          "provider": "html:img:src",
          "reference": null
        },
        {
          "metadata": {},
          "provider": "javascript:string",
          "reference": null
        },
        {
          "metadata": {},
          "provider": "html:form:action",
          "reference": null
        },
        {
          "metadata": {},
          "provider": "html:source:src",
          "reference": null
        },
        {
          "metadata": {},
          "provider": "robots:robots.txt",
          "reference": null
        },
        {
          "metadata": {},
          "provider": "sitemap:sitemap.xml",
          "reference": null
        }
      ],
      "type": "HOSTNAME",
      "value": "ginandjuice.shop"
    }
  ],
  "authorization": {
    "provider": "scopeguard",
    "reference": "GIN-JUICE-SHOP-WEB-001"
  },
  "dns_observations": [
    {
      "asset_id": null,
      "hostname": "ginandjuice.shop",
      "id": "a8cba9ec-3888-46b8-b638-6586e7a11693",
      "observed_at": "2026-09-26T06:34:35.700901Z",
      "records": [
        {
          "ttl": 42,
          "type": "A",
          "value": "34.246.169.176"
        },
        {
          "ttl": 42,
          "type": "A",
          "value": "34.249.203.140"
        }
      ],
      "state": "RESOLVED"
    }
  ],
  "endpoints": [
    {
      "asset_id": "f2aef6b6-befd-4afb-8bf5-27d7ed5a9597",
      "body_parameters": {},
      "content_type": null,
      "discovered_from": null,
      "hostname": "ginandjuice.shop",
      "id": "4d157a68-62e4-4d33-b84e-193157dafc9a",
      "metadata": {
        "authorized_seed": true,
        "discovered_from_values": [
          "https://ginandjuice.shop/"
        ],
        "source": "configured_target",
        "sources": [
          "configured_target",
          "html:a:href",
          "web:page"
        ]
      },
      "method": "GET",
      "parent_endpoint": null,
      "path": "/",
      "port": 443,
      "query_parameter_values": {},
      "query_parameters": {},
      "scheme": "https",
      "service_id": null,
      "source": "configured_target",
      "url": "https://ginandjuice.shop/"
    },
    {
      "asset_id": "f2aef6b6-befd-4afb-8bf5-27d7ed5a9597",
      "body_parameters": {
        "csrf": null,
        "email": null
      },
      "content_type": null,
      "discovered_from": "https://ginandjuice.shop/",
      "hostname": "ginandjuice.shop",
      "id": "e1ef97e7-9c57-4f23-ab93-58f965ab8000",
      "metadata": {
        "discovered_by": "web",
        "parent_url": "https://ginandjuice.shop/",
        "source": "html:data-action",
        "sources": [
          "html:data-action"
        ]
      },
      "method": "POST",
      "parent_endpoint": null,
      "path": "/catalog/subscribe",
      "port": 443,
      "query_parameter_values": {},
      "query_parameters": {},
      "scheme": "https",
      "service_id": null,
      "source": "html:data-action",
      "url": "https://ginandjuice.shop/catalog/subscribe"
    },
    {
      "asset_id": "f2aef6b6-befd-4afb-8bf5-27d7ed5a9597",
      "body_parameters": {},
      "content_type": null,
      "discovered_from": "https://ginandjuice.shop/",
      "hostname": "ginandjuice.shop",
      "id": "7599ac5e-7e4e-4bc7-b985-6ee9ab7ee056",
      "metadata": {
        "discovered_by": "web",
        "parent_url": "https://ginandjuice.shop/",
        "source": "html:link:href",
        "sources": [
          "html:link:href"
        ]
      },
      "method": "GET",
      "parent_endpoint": null,
      "path": "/resources/labheader/css/scanMeHeader.css",
      "port": 443,
      "query_parameter_values": {},
      "query_parameters": {},
      "scheme": "https",
      "service_id": null,
      "source": "html:link:href",
      "url": "https://ginandjuice.shop/resources/labheader/css/scanMeHeader.css"
    },
    {
      "asset_id": "f2aef6b6-befd-4afb-8bf5-27d7ed5a9597",
      "body_parameters": {},
      "content_type": null,
      "discovered_from": "https://ginandjuice.shop/",
      "hostname": "ginandjuice.shop",
      "id": "8ae01892-701e-4fa6-a4f3-ca1a5801822a",
      "metadata": {
        "discovered_by": "web",
        "parent_url": "https://ginandjuice.shop/",
        "source": "html:link:href",
        "sources": [
          "html:link:href"
        ]
      },
      "method": "GET",
      "parent_endpoint": null,
      "path": "/resources/css/labsScanme.css",
      "port": 443,
      "query_parameter_values": {},
      "query_parameters": {},
      "scheme": "https",
      "service_id": null,
      "source": "html:link:href",
      "url": "https://ginandjuice.shop/resources/css/labsScanme.css"
    },
    {
      "asset_id": "f2aef6b6-befd-4afb-8bf5-27d7ed5a9597",
      "body_parameters": {},
      "content_type": null,
      "discovered_from": "https://ginandjuice.shop/",
      "hostname": "ginandjuice.shop",
      "id": "e0a8d703-5ad9-4e79-9709-b7e5a0f8e813",
      "metadata": {
        "discovered_by": "web",
        "discovered_from_values": [
          "https://ginandjuice.shop/"
        ],
        "parent_url": "https://ginandjuice.shop/",
        "source": "html:script:src",
        "sources": [
          "html:script:src",
          "javascript:string"
        ]
      },
      "method": "GET",
      "parent_endpoint": null,
      "path": "/resources/js/react.development.js",
      "port": 443,
      "query_parameter_values": {},
      "query_parameters": {},
      "scheme": "https",
      "service_id": null,
      "source": "html:script:src",
      "url": "https://ginandjuice.shop/resources/js/react.development.js"
    },
    {
      "asset_id": "f2aef6b6-befd-4afb-8bf5-27d7ed5a9597",
      "body_parameters": {},
      "content_type": null,
      "discovered_from": "https://ginandjuice.shop/",
      "hostname": "ginandjuice.shop",
      "id": "a0480c00-9460-4667-bb76-5a1d706d1be7",
      "metadata": {
        "discovered_by": "web",
        "discovered_from_values": [
          "https://ginandjuice.shop/"
        ],
        "parent_url": "https://ginandjuice.shop/",
        "source": "html:script:src",
        "sources": [
          "html:script:src",
          "javascript:string"
        ]
      },
      "method": "GET",
      "parent_endpoint": null,
      "path": "/resources/js/react-dom.development.js",
      "port": 443,
      "query_parameter_values": {},
      "query_parameters": {},
      "scheme": "https",
      "service_id": null,
      "source": "html:script:src",
      "url": "https://ginandjuice.shop/resources/js/react-dom.development.js"
    },
    {
      "asset_id": "f2aef6b6-befd-4afb-8bf5-27d7ed5a9597",
      "body_parameters": {},
      "content_type": null,
      "discovered_from": "https://ginandjuice.shop/",
      "hostname": "ginandjuice.shop",
      "id": "30f414c8-aa86-456a-9a55-0fb7e6b1ebe0",
      "metadata": {
        "discovered_by": "web",
        "discovered_from_values": [
          "https://ginandjuice.shop/"
        ],
        "parent_url": "https://ginandjuice.shop/",
        "source": "html:script:src",
        "sources": [
          "html:script:src",
          "javascript:string"
        ]
      },
      "method": "GET",
      "parent_endpoint": null,
      "path": "/resources/js/angular_1-7-7.js",
      "port": 443,
      "query_parameter_values": {},
      "query_parameters": {},
      "scheme": "https",
      "service_id": null,
      "source": "html:script:src",
      "url": "https://ginandjuice.shop/resources/js/angular_1-7-7.js"
    },
    {
      "asset_id": "f2aef6b6-befd-4afb-8bf5-27d7ed5a9597",
      "body_parameters": {
        "searchTerm": null
      },
      "content_type": null,
      "discovered_from": "https://ginandjuice.shop/",
      "hostname": "ginandjuice.shop",
      "id": "daaee120-fe3a-4845-8662-672aae25003e",
      "metadata": {
        "discovered_by": "web",
        "discovered_from_values": [
          "https://ginandjuice.shop/",
          "https://ginandjuice.shop/catalog"
        ],
        "parent_url": "https://ginandjuice.shop/",
        "source": "html:a:href",
        "sources": [
          "html:a:href",
          "html:form:action",
          "javascript:string",
          "web:page"
        ]
      },
      "method": "GET",
      "parent_endpoint": null,
      "path": "/catalog",
      "port": 443,
      "query_parameter_values": {
        "category": [
          "Accessories",
          "Accompaniments",
          "Books",
          "Gin",
          "Juice"
        ]
      },
      "query_parameters": {
        "category": null
      },
      "scheme": "https",
      "service_id": null,
      "source": "html:a:href",
      "url": "https://ginandjuice.shop/catalog"
    },
    {
      "asset_id": "f2aef6b6-befd-4afb-8bf5-27d7ed5a9597",
      "body_parameters": {},
      "content_type": null,
      "discovered_from": "https://ginandjuice.shop/",
      "hostname": "ginandjuice.shop",
      "id": "ee695155-b716-4024-98b7-6b147ffab822",
      "metadata": {
        "discovered_by": "web",
        "discovered_from_values": [
          "https://ginandjuice.shop/"
        ],